S/O No.,S/O Line,Main Batch Plant,Schedule Date,Sales Name,Customer ID,Customer Name,Project ID,Project Location,Project Adress,Project Tel,Product Code,Order Qty.,Delivered / Order Volume (M3),1-24Hr,1,2,3,4,5,6,7,8,9,10,11,12,13,14,15,16,17,18,19,20,21,22,23,24,UnLoading Method,Term,Remark,Reason
,,,,,,,,,,,,,,,,,,,,,,,,,,,,,,,,,,,,,,,,Of,,
,,,,,,,,,,,,,,,,,,,,,,,,,,,,,,,,,,,,,,,,Payment,,
,,,,,,,,,,,,,,,,,,,,,,,,,,,,,,,,,,,,,,,,,,
SO02-IDM211200249,1,Y,12/12/2021,FERDY WIDASMARA,CU00270,CV MULTI TEKNIK NUSANTARA,DPMTN00391,JEMBATAN GG MAIT KP GABUS DUKUH DS SRIMUKTI,TAMBUN UTARA    , ,35PX12A06R1X,10.00 ,10.00 ,10.00,,,,,,,,,,,,,,,,,10.00,,,,,,,,,C0000E,,
SO02-IDM211200238,1,Y,12/12/2021,DEDE JUNAEDI,CU04598,PT. MITRA PRATAMA MANDIRI JAYA PERKASA,DPMPJ00008,JL DEPAN PT MONI 2,BEKASI    , ,25PX12A06XXX,20.00 ,20.00 ,7.00,,,,,,,,,,,,,,,,,7.00,,,,,,,,,C0000E,,
SO02-IDM211200237,1,Y,12/12/2021,DEDE JUNAEDI,CU04598,PT. MITRA PRATAMA MANDIRI JAYA PERKASA,DPMPJ00008,JL DEPAN PT MONI 2,BEKASI    , ,30PX12A06XXX,3.00 ,3.00 ,3.00,,,,,,,,,,,,,,,,,3.00,,,,,,,,,C0000E,,
SO02-IDM211200040,1,Y,12/12/2021,DEDE JUNAEDI,CU04598,PT. MITRA PRATAMA MANDIRI JAYA PERKASA,DPMPJ00008,JL DEPAN PT MONI 2,BEKASI    , ,30PX12A06XXX,15.00 ,4.00 ,4.00,,,,,,,,,,,,,,,,,4.00,,,,,,,,,C0000E,,
SO03-IDM211200139,1,Y,12/12/2021,DEDE JUNAEDI,CU04939,PT. MITRA ANDALAN SAKTI,DPMAI00007,PENINGKATAN JEMBATAN AKSES RUSUN PESAKIH CENGKARENG,JAKARTA BARAT    , ,VIPER08,225.00 ,225.00 ,7.00,,,,,,,,,,,,,,,,,7.00,,,,,,,,,C3000D,,
