S/O No.,S/O Line,Main Batch Plant,Schedule Date,Sales Name,Customer ID,Customer Name,Project ID,Project Location,Project Adress,Project Tel,Product Code,Delivered / Order Volume (M3),1-24Hr,1,2,3,4,5,6,7,8,9,10,11,12,13,14,15,16,17,18,19,20,21,22,23,24,UnLoading Method,Term,Remark,Reason
,,,,,,,,,,,,,,,,,,,,,,,,,,,,,,,,,,,,,,,Of,,
,,,,,,,,,,,,,,,,,,,,,,,,,,,,,,,,,,,,,,,Payment,,
PLANT: R32TGD - Plant Tegal Danas - Cikarang,,,,,,,,,,,,,,,,,,,,,,,,,,,,,,,,,,,,,,,,,
SO02-IDM210900355,1,Y,11/10/2021,DEDE JUNAEDI,CT04945,BP RINAL RIGJEN SITORUS (NIK 3201070404790024),DRRRS00002,PASIR ANGIN KEC CILEUNGSI BOGOR,BOGOR    , ,25PX12A06XXX,28.00 ,7.0,,,,,,,,,,,,,,,,7.00,,,,,,,,,MANUAL,C0000E,,
SO02-IDM211000120,1,Y,11/10/2021,NANDANG PRIATNA,CT04983,IBU LIS CIPTA SARI (NIK 3175067108820017),DRLCS00006,DACON JAYA BETON JL SELANG BULAK NO 42 RT 3 RW 1 WANAJAYA KEC CIBITUNG,KAB BEKASI    , ,40PX12C06XXX,30.00 ,7.0,,,,,,,,,,7.00,,,,,,,,,,,,,,,MANUAL,C0000E,,
SO03-IDM211000150,1,Y,11/10/2021,DEDE JUNAEDI,CU01505,PT WANINDO SENA PERKASA,DPWSP00027,PERUMAHAN CITRA GRAN CIBUBUR BLOK DD 01 NO 3,JL ALTERNATIF CIBUBUR KM 4    , ,22FI12A06XXX,26.00 ,26.0,,,,,,,,,7.00,14.00,5.00,,,,,,,,,,,,,,CPS,C3000D,,
SO03-IDM211000173,1,Y,11/10/2021,DEDE JUNAEDI,CU01209,PT. KORSA PERSADA ASIA,DDKPA00011,BP AJI. KOTA WISATA CIBUBUR CLUSTER NASH VILLE BLOK TD 3 NO 11,JAKARTA TIMUR    , ,25FI12A06XXX,12.00 ,12.0,,,,,,,,6.00,6.00,,,,,,,,,,,,,,,,MANUAL,C3000D,,
SO02-IDM211000166,1,Y,11/10/2021,DEDE JUNAEDI,CT04475,BP BUDI SANTOSA (NIK 3201072408930001),DRBSA00008,JL TAMAN RAHAYU KEC SETU,BEKASI JAWABARAT 17320    , ,35PX12A06XXX,70.00 ,35.0,,,,,,,,,,,,,,,,,,,7.00,7.00,7.00,7.00,7.00,,MANUAL,C0000E,,
SO03-IDM210900568,1,Y,11/10/2021,DEDE JUNAEDI,CU00211,PT IKAGRIYA DARMAPERSADA,DPIDA00259,CITRALAND14. CLUSTER MONTEREY KM 4 BLOK F6 NO 3,JONGGOL    , ,17FI12A06XXX,38.00 ,5.0,,,,,,,,5.00,,,,,,,,,,,,,,,,,MANUAL,C3000C,,
