S/O No.,S/O Line,Main Batch Plant,Schedule Date,Sales Name,Customer ID,Customer Name,Project ID,Project Location,Project Adress,Project Tel,Product Code,Order Qty.,Delivered / Order Volume (M3),1-24Hr,1,2,3,4,5,6,7,8,9,10,11,12,13,14,15,16,17,18,19,20,21,22,23,24,UnLoading Method,Term,Remark,Reason
,,,,,,,,,,,,,,,,,,,,,,,,,,,,,,,,,,,,,,,,Of,,
,,,,,,,,,,,,,,,,,,,,,,,,,,,,,,,,,,,,,,,,Payment,,
,,,,,,,,,,,,,,,,,,,,,,,,,,,,,,,,,,,,,,,,,,
SO03-IDM210900168,1,Y,19/12/2021,DEDE JUNAEDI,CU04558,ADHI-NINDYA KSO,DPANK00003,PENGENDALIAN BANJIR KALI BEKASI PAKET 1,KOTA BEKASI ANDUNG JAWA BARAT    , ,30BX18A06XXX,5000.00 ,3479.50 ,21.00,,,,,,,,,,,,,,,,,,7.00,7.00,7.00,,,,,MANUAL,C3000D,,
SO03-IDM211000296,1,Y,19/12/2021,DEDE JUNAEDI,CU04558,ADHI-NINDYA KSO,DPANK00003,PENGENDALIAN BANJIR KALI BEKASI PAKET 1,KOTA BEKASI ANDUNG JAWA BARAT    , ,22PX12A06XXX,4000.00 ,3688.50 ,21.00,,,,,,,,,,,,,,,,,,,,,7.00,7.00,7.00,,MANUAL,C3000D,,
SO03-IDM211200325,1,Y,19/12/2021,FERDY WIDASMARA,CU04337,PT. BAHTERA MADYA UTAMA,DPBMU00002,"PT UNIVERSAL AGRI BISNISINDO. JL RAYA NAROGONG KM 13,5 BANTAR GEBANG",BEKASI    , ,30PX12A06XXX,210.00 ,210.00 ,210.00,,,,,,,,35.00,21.00,35.00,21.00,35.00,21.00,35.00,7.00,,,,,,,,,,CP,C0000E,,
SO03-IDM211100119,1,Y,19/12/2021,DEDE JUNAEDI,CU04324,PT. KUSUMA KARYA ABADI,DPKKA00004,GEREJA TIBERIAS BEKASI TOWN SQUARE (BETOS) JL CUT MEUTIA KEL MARGAHAYU,KEC BEKASI TIMUR    , ,35PX12A06XXX,500.00 ,214.50 ,84.00,,,,,,,,,,,,,,,,14.00,21.00,14.00,21.00,14.00,,,,,CP,C6000D,,
SO03-IDM211200139,1,Y,19/12/2021,DEDE JUNAEDI,CU04939,PT. MITRA ANDALAN SAKTI,DPMAI00007,PENINGKATAN JEMBATAN AKSES RUSUN PESAKIH CENGKARENG,JAKARTA BARAT    , ,VIPER08,225.00 ,169.00 ,42.00,,,,,,,,,,,,,,,,,,,,,,,21.00,21.00,MANUAL,C3000D,,
SO03-IDM211200177,1,Y,19/12/2021,FERDY WIDASMARA,CU04616,PT. STRADA CAHYA GEMILANG,DPSCG00113,TRIBUANA MULTI KARYA. MABES TNI CILANGKAP JL PINTU 2 MABES TNI AL CILANGKAP,CIPAYUNG JAKARTA TIMUR    , ,35BX18A06XXX,500.00 ,500.00 ,42.00,,,,,,,,,,,,,,,7.00,7.00,7.00,7.00,7.00,7.00,,,,,MANUAL,C3000D,,
