S/O No.,S/O Line,Main Batch Plant,Schedule Date,Sales Name,Customer ID,Customer Name,Project ID,Project Location,Project Adress,Project Tel,Product Code,Order Qty.,Delivered / Order Volume (M3),1-24Hr,1,2,3,4,5,6,7,8,9,10,11,12,13,14,15,16,17,18,19,20,21,22,23,24,UnLoading Method,Term,Remark,Reason,
,,,,,,,,,,,,,,,,,,,,,,,,,,,,,,,,,,,,,,,,Of,,,
,,,,,,,,,,,,,,,,,,,,,,,,,,,,,,,,,,,,,,,,Payment,,,
PLANT: R01JAT - Jati Asih,,,,,,,,,,,,,,,,,,,,,,,,,,,,,,,,,,,,,,,,,,,
SO03-IDM211000385,1,Y,15/11/2021,DEDE JUNAEDI,CU02666,PT JAYA TEKNIK PONDASI,DPJTP00003,WORKSHOP JAYA TEKNIK PONDASI. JL CARINGIN NO 149 KAMPUNG RAWA ROKO,BOJONG RAWA LUMBU BEKASI    , ,50PX12A06PTP,60.00 ,30.00 ,10.0,,,,,,,,,,,,5.00,5.00,,,,,,,,,,,,MANUAL,C3000A,,,
SO03-IDM211100239,1,Y,15/11/2021,DEDE JUNAEDI,CU04616,PT. STRADA CAHYA GEMILANG,DPSCG00100,"PT YESAYA EKASARANA. JL NAROGONG KM 13,5 PANGKALAN 5 (GANG AWIS) BEKASI",DEKAT PERBATASAN SELAMAT DATANG KAB BOGOR/KAB BEKASI    , ,25PX14A06XXX,14.00 ,14.00 ,14.0,,,,,,,,,,,7.00,7.00,,,,,,,,,,,,,MANUAL,C3000D,,,
SO02-IDM211100063,1,Y,15/11/2021,DEDE JUNAEDI,CU04772,PT. FITAMA PUTRI MANDIRI,DPFPM00007,PEKERJAAN LANJUTAN PENAMBAHAN IPAL BERSAMA UNTUK MENGELOLA SIR SUNGAI,YANG TERCEMAR AIR LINDI KEL SUMUR BATU KEC BANTARGEBANG BEKASI    , ,35PX12A06BKS,100.00 ,51.00 ,7.0,,,,,,,,,,,7.00,,,,,,,,,,,,,,MANUAL,C0000E,,,
SO03-IDM211000010,1,Y,15/11/2021,DEDE JUNAEDI,CU04168,PT BINA NUSANTARA RAYA,DPBNR00006,CLUSTER KENCANA KAWASAN VIDA BEKASI 17151,VIDA BEKASI    , ,17FI12A06XXX,100.00 ,67.00 ,6.0,,,,,,,,,,,,,,,,,6.00,,,,,,,,MANUAL,C3000D,,,
SO03-IDM211100057,1,Y,15/11/2021,DEDE JUNAEDI,CU04168,PT BINA NUSANTARA RAYA,DPBNR00006,CLUSTER KENCANA KAWASAN VIDA BEKASI 17151,VIDA BEKASI    , ,30FI12A06XXX,100.00 ,36.00 ,21.0,,,,,,,,,,,14.00,7.00,,,,,,,,,,,,,CPS,C3000D,,,
SO03-IDM211100152,1,Y,15/11/2021,DEDE JUNAEDI,CU04616,PT. STRADA CAHYA GEMILANG,DPSCG00098,CV PUTRA DUA BERSATU. REHAB SDN MUKTIJAYA 03,BEKASI    , ,25FI12A06XXX,14.00 ,14.00 ,14.0,,,,,,,,,,,,,,7.00,7.00,,,,,,,,,,MANUAL,C3000D,,,
