S/O No.,S/O Line,Main Batch Plant,Schedule Date,Sales Name,Customer ID,Customer Name,Project ID,Project Location,Project Adress,Project Tel,Product Code,Order Qty.,Delivered / Order Volume (M3),1-24Hr,1,2,3,4,5,6,7,8,9,10,11,12,13,14,15,16,17,18,19,20,21,22,23,24,UnLoading Method,Term,Remark,Reason
,,,,,,,,,,,,,,,,,,,,,,,,,,,,,,,,,,,,,,,,Of,,
,,,,,,,,,,,,,,,,,,,,,,,,,,,,,,,,,,,,,,,,Payment,,
,,,,,,,,,,,,,,,,,,,,,,,,,,,,,,,,,,,,,,,,,,
SO03-IDM220900397,1,Y,27/10/2022,FERDY WIDASMARA,CU00827,PT DELTA BAJA MASA,DPDBM00025,WSK BEKASI,BEKASI    , ,30FI12A06XXX,100.00 ,67.00 ,5.00,,,,,,,,,,5.00,,,,,,,,,,,,,,,MANUAL,C3000D,,
SO03-IDM220900376,1,Y,27/10/2022,FERDY WIDASMARA,CU04660,PT. PRIMA SOLUSI INTEGRA,DPPSI00093,12001457. PT PRIMA SOLUSI INTEGRA GUDANG JL CIPENDAWA BARU NO 288 KEC RAWALUMBU,KOTA BEKASI    , ,BC25XXA11XXX,600.00 ,208.00 ,14.00,,,,,,,,,7.00,7.00,,,,,,,,,,,,,,,MANUAL,C3000D,,
SO03-IDM221000269,1,Y,27/10/2022,FERDY WIDASMARA,CU04660,PT. PRIMA SOLUSI INTEGRA,DPPSI00096,12001476. PT PRIMA SOLUSI INTEGRA GUDANG JL CIPENDAWA BARU NO 288 KEC RAWALUMBU,KOTA BEKASI    , ,BC14XXC11XXX,210.00 ,196.00 ,14.00,,,,,,,,,,,7.00,7.00,,,,,,,,,,,,,MANUAL,C3000D,,
SO03-IDM221000198,1,Y,27/10/2022,FERDY WIDASMARA,CU05016,PT. MEGA CITRA PRATAMA,DPMCP00004,BUKIT PODOMORO JL I GUSTI NGURAH RAI KLENDER,JAKARTA    , ,30PX12A06XXX,1000.00 ,984.50 ,28.00,,,,,,,,,,,7.00,7.00,7.00,7.00,,,,,,,,,,,MANUAL,C3000D,,
SO03-IDM221000333,1,Y,27/10/2022,HERI KUSWANTO,CU01127,PT MULTIKARYA SARANAPERKASA,DPMSP00030,JPN - UNIT BEKASI JL PONDOK UNGU - KALIABANG NO 206 KM 031 RT 001 RW 024 PEJUANG,KEC MEDAN SATRIA KOTA BEKASI    , ,30PX12A06XXX,10.00 ,10.00 ,10.00,,,,,,,,10.00,,,,,,,,,,,,,,,,,MANUAL,C3000D,,
SO03-IDM221000226,1,Y,27/10/2022,HERI KUSWANTO,CU02666,PT JAYA TEKNIK PONDASI,DPJTP00003,WORKSHOP JAYA TEKNIK PONDASI. JL CARINGIN NO 149 KAMPUNG RAWA ROKO,BOJONG RAWA LUMBU BEKASI    , ,50PX12A06PTP,70.00 ,20.00 ,10.00,,,,,,,,,,,7.00,3.00,,,,,,,,,,,,,MANUAL,C4500D,,
