S/O No.,S/O Line,Main Batch Plant,Schedule Date,Sales Name,Customer ID,Customer Name,Project ID,Project Location,Project Adress,Project Tel,Product Code,Order Qty.,Delivered / Order Volume (M3),1-24Hr,1,2,3,4,5,6,7,8,9,10,11,12,13,14,15,16,17,18,19,20,21,22,23,24,UnLoading Method,Term,Remark,Reason,
,,,,,,,,,,,,,,,,,,,,,,,,,,,,,,,,,,,,,,,,Of,,,
,,,,,,,,,,,,,,,,,,,,,,,,,,,,,,,,,,,,,,,,Payment,,,
PLANT: R01JAT - Jati Asih,,,,,,,,,,,,,,,,,,,,,,,,,,,,,,,,,,,,,,,,,,,
SO03-IDM220700117,1,Y,12/08/2022,FERDY WIDASMARA,CU00827,PT DELTA BAJA MASA,DPDBM00025,WSK BEKASI,BEKASI    , ,30FI12A06XXX,200.00 ,124.00 ,7.00,,,,,,,,7.00,,,,,,,,,,,,,,,,,MANUAL,C3000D,,,
SO03-IDM220800044,1,Y,12/08/2022,HERI KUSWANTO,CU02632,PT KIRANA KURNIA KREASI,DPKKI00020,PERUM GRAND WISATA - LEMONADE BLOK CC8 CC9 CC10 CC12 CC17,BEKASI    , ,22FI12A06XXX,140.00 ,91.00 ,21.00,,,,,,,,,7.00,7.00,7.00,,,,,,,,,,,,,,MANUAL,C3000D,,,
SO02-IDM220700387,1,Y,12/08/2022,HERI KUSWANTO,CU04432,PT ALHADI BERKAH SUKSES,DPABS00113,BP RICKY ISKANDAR. CLUSTER ADMIRALTY BLOK A8 PD LABU,JAKARTA SELATAN    , ,25FN12A06XXX,60.00 ,60.00 ,60.00,,,,,,,,14.00,21.00,14.00,11.00,,,,,,,,,,,,,,CPS,C0000E,,,
SO02-IDM220700171,1,Y,12/08/2022,HERI KUSWANTO,CU05204,ABIPRAYA-DAKA KSO,DPADK00006,PROYEK PENGENDALIAN BANJIR KALI BEKASI PAKET 7,BEKASI    , ,30BX18A06R1X,350.00 ,89.00 ,20.00,,,,,,,,,7.00,7.00,6.00,,,,,,,,,,,,,,MANUAL,C0000E,,,
SO03-IDM220800105,1,Y,12/08/2022,HERI KUSWANTO,CU02666,PT JAYA TEKNIK PONDASI,DPJTP00003,WORKSHOP JAYA TEKNIK PONDASI. JL CARINGIN NO 149 KAMPUNG RAWA ROKO,BOJONG RAWA LUMBU BEKASI    , ,50PX12A06PTP,70.00 ,40.00 ,15.00,,,,,,,,,,7.00,8.00,,,,,,,,,,,,,,MANUAL,C4500D,,,
SO02-IDM220800218,1,Y,12/08/2022,FERDY WIDASMARA,CU05317,PT. GLOBAL SOLUSI TEKNINDO,DPGST00331,12000609. PT GLOBAL SOLUSI TEKNINDO JL. CIPENDAWA BARU NO.288 KELURAHAN BOJONG,"MENTENG KECAMATAN RAWALUMBU, KOTA BEKASI    ", ,BC25XXA11XXX,32.00 ,25.00 ,7.00,,,,,,,,,,,,,7.00,,,,,,,,,,,,MANUAL,C0000E,,,
