S/O No.,S/O Line,Main Batch Plant,Schedule Date,Sales Name,Customer ID,Customer Name,Project ID,Project Location,Project Adress,Project Tel,Product Code,Order Qty.,Delivered / Order Volume (M3),1-24Hr,1,2,3,4,5,6,7,8,9,10,11,12,13,14,15,16,17,18,19,20,21,22,23,24,UnLoading Method,Term,Remark,Reason,
,,,,,,,,,,,,,,,,,,,,,,,,,,,,,,,,,,,,,,,,Of,,,
,,,,,,,,,,,,,,,,,,,,,,,,,,,,,,,,,,,,,,,,Payment,,,
PLANT: R01JAT - Jati Asih,,,,,,,,,,,,,,,,,,,,,,,,,,,,,,,,,,,,,,,,,,,
SO02-IDM220100283,1,Y,02/02/2022,DEDE JUNAEDI,CU00190,PT. DUA PUTRA PERKASA PRATAMA,DPDPP00025,PT DUA PUTRA PERKASA KWS INDUSTRI CIPENDAWA JL BARU CIPENDAWA NO 88,KEL BOJONG MENTENG KEC RAWA LUMBU KOTA BEKASI    , ,35PX12A06XXX,200.00 ,56.00 ,7.00,,,,,,,,,7.00,,,,,,,,,,,,,,,,MANUAL,C0000A,,,
SO02-IDM220100347,1,Y,02/02/2022,DEDE JUNAEDI,CU00190,PT. DUA PUTRA PERKASA PRATAMA,DPDPP00025,PT DUA PUTRA PERKASA KWS INDUSTRI CIPENDAWA JL BARU CIPENDAWA NO 88,KEL BOJONG MENTENG KEC RAWA LUMBU KOTA BEKASI    , ,40PX12A06XXX,200.00 ,14.00 ,7.00,,,,,,,,,,7.00,,,,,,,,,,,,,,,MANUAL,C0000A,,,
SO02-IDM220100421,1,Y,02/02/2022,DEDE JUNAEDI,CU00190,PT. DUA PUTRA PERKASA PRATAMA,DPDPP00025,PT DUA PUTRA PERKASA KWS INDUSTRI CIPENDAWA JL BARU CIPENDAWA NO 88,KEL BOJONG MENTENG KEC RAWA LUMBU KOTA BEKASI    , ,40PX12A06XXX,200.00 ,7.00 ,7.00,,,,,,,,,,,7.00,,,,,,,,,,,,,,MANUAL,C0000A,,,
SO03-IDM220100301,1,Y,02/02/2022,DEDE JUNAEDI,CU04616,PT. STRADA CAHYA GEMILANG,DPSCG00100,"PT YESAYA EKASARANA. JL NAROGONG KM 13,5 PANGKALAN 5 (GANG AWIS) BEKASI",DEKAT PERBATASAN SELAMAT DATANG KAB BOGOR/KAB BEKASI    , ,30PX14A06XXX,130.00 ,130.00 ,5.00,,,,,,,,5.00,,,,,,,,,,,,,,,,,MANUAL,C3000D,,,
SO03-IDM220100408,1,Y,02/02/2022,DEDE JUNAEDI,CU02666,PT JAYA TEKNIK PONDASI,DPJTP00003,WORKSHOP JAYA TEKNIK PONDASI. JL CARINGIN NO 149 KAMPUNG RAWA ROKO,BOJONG RAWA LUMBU BEKASI    , ,50PX12A06PTP,80.00 ,65.00 ,15.00,,,,,,,,,,,,5.00,5.00,5.00,,,,,,,,,,,MANUAL,C4500D,,,
