S/O No.,S/O Line,Main Batch Plant,Schedule Date,Sales Name,Customer ID,Customer Name,Project ID,Project Location,Project Adress,Project Tel,Product Code,Order Qty.,Delivered / Order Volume (M3),1-24Hr,1,2,3,4,5,6,7,8,9,10,11,12,13,14,15,16,17,18,19,20,21,22,23,24,UnLoading Method,Term,Remark,Reason
,,,,,,,,,,,,,,,,,,,,,,,,,,,,,,,,,,,,,,,,Of,,
,,,,,,,,,,,,,,,,,,,,,,,,,,,,,,,,,,,,,,,,Payment,,
,,,,,,,,,,,,,,,,,,,,,,,,,,,,,,,,,,,,,,,,,,
SO21-IDM221000014,1,Y,03/11/2022,SULAIMAN,CU00234,PT KARYA PALMALINDO ANUGERAH,DPKPA00045,DEPARTEMEN PAKIN,JAKARTA    , ,VCTB,216.00 ,216.00 ,12.00,,,,,,,,,,,,,,,,,,,6.00,6.00,,,,,MANUAL,C3000D,,
SO21-IDM221000015,1,Y,03/11/2022,SULAIMAN,CU00234,PT KARYA PALMALINDO ANUGERAH,DPKPA00045,DEPARTEMEN PAKIN,JAKARTA    , ,VIPER08,288.00 ,288.00 ,12.00,,,,,,,,,,,,,,,,,,,,,6.00,6.00,,,MANUAL,C3000D,,
SO21-IDM221000011,1,Y,03/11/2022,FERDY WIDASMARA,CU02126,PT KADI INTERNATIONAL,DPKII00008,REKONSTRUKSI PERKERASAN PERKERASAN PADA RUAS JALAN TOL JORR RUAS E1 E2 E3 W2S,JALUR A DAN ULUJAMI - PONDOK RANJI JALUR B TAHUN 2022    , ,VIPER45-03,125.00 ,70.10 ,12.00,,,,,,,,,,,,,,,,,,,,,,,6.00,6.00,MANUAL,C3000D,,
SO21-IDM221000013,1,Y,03/11/2022,FERDY WIDASMARA,CU01857,PT HAKAASTON,DPHKS00013,REKONSTRUKSI PERKERASAN JALAN TOL JORR-S KM 19+500 - KM 33+800,JORR-S    , ,VIPER45-03,641.55 ,599.05 ,12.00,,,,,,,,,,,,,,,,,,,,,6.00,6.00,,,MANUAL,C9000D,,
SO11-IDM220400002,1,Y,03/11/2022,FERDY WIDASMARA,CI00004,PT MOTIVE MULIA,CIMTM00411,REKONSTRUKSI PERKERASAN PERKERASAN PADA RUAS JALAN TOL JORR RUAS E1 E2 E3 W2S,JALUR A DAN ULUJAMI - PONDOK RANJI JALUR B TAHUN 2022    , ,BC25XXA06JOR,813.75 ,597.95 ,12.00,,,,,,,,,,,,,,,,,,,,6.00,6.00,,,,MANUAL,C3000C,,
