S/O No.,S/O Line,Main Batch Plant,Schedule Date,Sales Name,Customer ID,Customer Name,Project ID,Project Location,Project Adress,Project Tel,Product Code,Order Qty.,Delivered / Order Volume (M3),1-24Hr,1,2,3,4,5,6,7,8,9,10,11,12,13,14,15,16,17,18,19,20,21,22,23,24,UnLoading Method,Term,Remark,Reason
,,,,,,,,,,,,,,,,,,,,,,,,,,,,,,,,,,,,,,,,Of,,
,,,,,,,,,,,,,,,,,,,,,,,,,,,,,,,,,,,,,,,,Payment,,
,,,,,,,,,,,,,,,,,,,,,,,,,,,,,,,,,,,,,,,,,,
SO03-IDM220100298,1,Y,22/01/2022,DEDE JUNAEDI,CU02666,PT JAYA TEKNIK PONDASI,DPJTP00003,WORKSHOP JAYA TEKNIK PONDASI. JL CARINGIN NO 149 KAMPUNG RAWA ROKO,BOJONG RAWA LUMBU BEKASI    , ,50PX12A06PTP,80.00 ,80.00 ,15.00,,,,,,,,,,,,5.00,5.00,5.00,,,,,,,,,,,MANUAL,C4500D,,
SO02-IDM220100360,1,Y,22/01/2022,FERDY WIDASMARA,CT02314,BP BUYUNG WIRAWAN/PD.BAJA ASIA,DRBWW00002,SAKURA REGENCY 3. JL. MUSTIKA SARI KP. RAWA SAPI JATIMULYA,BEKASI TIMUR    ,081310048818,40FI12A06XXX,5.00 ,5.00 ,5.00,,,,,,,,,5.00,,,,,,,,,,,,,,,,MANUAL,C0000E,,
SO03-IDM211200246,1,Y,22/01/2022,FERDY WIDASMARA,CU04572,PT TOTALINDO EKA PERSADA,DPTBC00022,RUMAH SUSUN CILANGKAP JL RAYA CILANGKAP RT 005 RW 001 CILANGKAP,JAKARTA TIMUR    , ,35MI12A06R1X,2000.00 ,173.00 ,98.00,,,,,,,,,,,,,,,,,,14.00,14.00,14.00,14.00,14.00,14.00,14.00,TC,C9000D,,
SO03-IDM220100298,1,Y,22/01/2022,DEDE JUNAEDI,CU02666,PT JAYA TEKNIK PONDASI,DPJTP00003,WORKSHOP JAYA TEKNIK PONDASI. JL CARINGIN NO 149 KAMPUNG RAWA ROKO,BOJONG RAWA LUMBU BEKASI    , ,50PX12A06PTP,80.00 ,80.00 ,14.00,,,,,,,,7.00,7.00,,,,,,,,,,,,,,,,MANUAL,C4500D,,
SO02-IDM220100347,1,Y,22/01/2022,DEDE JUNAEDI,CU00190,PT. DUA PUTRA PERKASA PRATAMA,DPDPP00025,PT DUA PUTRA PERKASA KWS INDUSTRI CIPENDAWA JL BARU CIPENDAWA NO 88,KEL BOJONG MENTENG KEC RAWA LUMBU KOTA BEKASI    , ,40PX12A06XXX,200.00 ,200.00 ,175.00,,,,,,,,21.00,14.00,21.00,14.00,21.00,14.00,21.00,14.00,21.00,14.00,,,,,,,,MANUAL,C0000A,,
