S/O No.,S/O Line,Main Batch Plant,Schedule Date,Sales Name,Customer ID,Customer Name,Project ID,Project Location,Project Adress,Project Tel,Product Code,Order Qty.,Delivered / Order Volume (M3),1-24Hr,1,2,3,4,5,6,7,8,9,10,11,12,13,14,15,16,17,18,19,20,21,22,23,24,UnLoading Method,Term,Remark,Reason
,,,,,,,,,,,,,,,,,,,,,,,,,,,,,,,,,,,,,,,,Of,,
,,,,,,,,,,,,,,,,,,,,,,,,,,,,,,,,,,,,,,,,Payment,,
,,,,,,,,,,,,,,,,,,,,,,,,,,,,,,,,,,,,,,,,,,
SO03-IDM220400041,1,Y,31/03/2022,ARGO YOSO,CU04817,WIKA - JAYA KONSTRUKSI KSO,DPWJK00004,PEMBANGUNAN SUDETAN KALI CILIWUNG KE KANAL BANJIR TIMUR (KBT),JAKARTA TIMUR    , ,17BD18A06SKL,235.50 ,235.50 ,7.00,,,,,,,,,,,,,,,,,,,,,,,,,MANUAL,C9000D,,
SO03-IDM220400044,1,Y,31/03/2022,FERDY WIDASMARA,CU05088,PT. ROADMIXINDO RAYA,DPRMR00002,PEKERJAAN PEMELIHARAAN PERIODIK DAN REKONSTRUKSI PERKERASAN RUAS JALAN TOL JORR,SEKSI W2 UTARA JALUR A DAN B TAHUN 2022    , ,VIPER45-06,122.50 ,122.50 ,7.00,,,,,,,,,,,,,,,,,,,,,,7.00,,,MANUAL,C6000D,,
SO03-IDM220400045,1,Y,31/03/2022,DEDE JUNAEDI,CU02632,PT KIRANA KURNIA KREASI,DPKKI00016,GRAND WISATA - CLUSTER WATER TERRACE BLOK BE18 BE20 BE21 BE25,BEKASI    , ,22FI12A06XXX,185.00 ,185.00 ,7.00,,,,,,,,,,,,,,,,,,,,,,,7.00,,MANUAL,C3000D,,
SO03-IDM220400047,1,Y,31/03/2022,FERDY WIDASMARA,CU00234,PT KARYA PALMALINDO ANUGERAH,DPKPA00019,PROYEK JALAN LINGKAR LUAR BARAT,JAKARTA    , ,VIPER08,381.50 ,381.50 ,7.00,,,,,,,,,,,,,,,,,,,,,,,,7.00,MANUAL,C3000D,,
SO03-IDM220400048,1,Y,31/03/2022,FERDY WIDASMARA,CU00234,PT KARYA PALMALINDO ANUGERAH,DPKPA00019,PROYEK JALAN LINGKAR LUAR BARAT,JAKARTA    , ,VCTB,178.50 ,178.50 ,7.00,,,,,,,,,,,,,,,,,,,,,,,7.00,,MANUAL,C3000D,,
