S/O No.,S/O Line,Main Batch Plant,Schedule Date,Sales Name,Customer ID,Customer Name,Project ID,Project Location,Project Adress,Project Tel,Product Code,Order Qty.,Delivered / Order Volume (M3),1-24Hr,1,2,3,4,5,6,7,8,9,10,11,12,13,14,15,16,17,18,19,20,21,22,23,24,UnLoading Method,Term,Remark,Reason
,,,,,,,,,,,,,,,,,,,,,,,,,,,,,,,,,,,,,,,,Of,,
,,,,,,,,,,,,,,,,,,,,,,,,,,,,,,,,,,,,,,,,Payment,,
PLANT: R15MSP - Plant Gresik (Maspion),,,,,,,,,,,,,,,,,,,,,,,,,,,,,,,,,,,,,,,,,,
SO03-IDM221000259,1,Y,01/12/2022,SUGENG WINARTO,CU00407,PT WILMAR NABATI INDONESIA,DPWIL00371,8102416477. PONDASI MAIN BUILDING DAN TANKFARM MCT,FRANCO GRESIK INDONESIA GR - GRESIK KB (KAWASAN BERIKAT)    , ,30PX12A31XXX,1060.00 ,972.00 ,42.00,,,,,,,,,,,,7.00,14.00,14.00,7.00,,,,,,,,,,MANUAL,C3000D,,
SO02-IDM221100706,1,Y,01/12/2022,SUGENG WINARTO,CU02777,PT ADI MILLINDO MESIN,DPAMM00004,PEKERJAAN CIVIL PENGECORAN PONDASI MESIN DAN SLAB DI PABRIK PT POLOWIJO,GRESIK    , ,30PX12A31XXX,49.00 ,49.00 ,49.00,,,,,,,,14.00,14.00,14.00,7.00,,,,,,,,,,,,,,CPS,C0000E,,
SO03-IDM220700005,1,Y,01/12/2022,SUGENG WINARTO,CU00407,PT WILMAR NABATI INDONESIA,DPWIL00348,8102407102. BETON PASTILATOR,FRANCO GRESIK INDONESIA GR - GRESIK KB (KAWASAN BERIKAT)    , ,30PX12A31XXX,740.00 ,534.00 ,12.00,,,,,,,,,7.00,5.00,,,,,,,,,,,,,,,MANUAL,C3000D,,
SO03-IDM221100314,1,Y,01/12/2022,SUGENG WINARTO,CU02508,PT THE MASTER STEEL MANUFACTORY,DPTMS00050,PT THE MASTER STEEL KAWASAN INDUSTRI MASPION UNIT V (UTARA KANAUFF),MANYAR GRESIK    , ,25FU10A31XXX,12.00 ,12.00 ,6.00,,,,,,,,6.00,,,,,,,,,,,,,,,,,MANUAL,C3000D,,
SO03-IDM221100281,1,Y,01/12/2022,SUGENG WINARTO,CU02508,PT THE MASTER STEEL MANUFACTORY,DPTMS00050,PT THE MASTER STEEL KAWASAN INDUSTRI MASPION UNIT V (UTARA KANAUFF),MANYAR GRESIK    , ,25FU10A31XXX,20.00 ,4.00 ,4.00,,,,,,,,4.00,,,,,,,,,,,,,,,,,MANUAL,C3000D,,
