S/O No.,S/O Line,Main Batch Plant,Schedule Date,Sales Name,Customer ID,Customer Name,Project ID,Project Location,Project Adress,Project Tel,Product Code,Order Qty.,Delivered / Order Volume (M3),1-24Hr,1,2,3,4,5,6,7,8,9,10,11,12,13,14,15,16,17,18,19,20,21,22,23,24,UnLoading Method,Term,Remark,Reason,
,,,,,,,,,,,,,,,,,,,,,,,,,,,,,,,,,,,,,,,,Of,,,
,,,,,,,,,,,,,,,,,,,,,,,,,,,,,,,,,,,,,,,,Payment,,,
PLANT: R01JAT - Jati Asih,,,,,,,,,,,,,,,,,,,,,,,,,,,,,,,,,,,,,,,,,,,
SO03-IDM220200063,1,Y,12/02/2022,DEDE JUNAEDI,CU02666,PT JAYA TEKNIK PONDASI,DPJTP00003,WORKSHOP JAYA TEKNIK PONDASI. JL CARINGIN NO 149 KAMPUNG RAWA ROKO,BOJONG RAWA LUMBU BEKASI    , ,50PX12A06PTP,80.00 ,45.00 ,14.00,,,,,,,,,,,,,7.00,7.00,,,,,,,,,,,MANUAL,C4500D,,,
SO02-IDM220200108,1,Y,12/02/2022,DEDE JUNAEDI,CU05029,PT. PERMATA HARAPAN TUBERSEL,DPPHT00002,CITRALAND CIBUBUR MEKARSARI NEW ARECA JL RAYA JONGGOL CILEUNGSI,BOGOR    , ,22FI12A06XXX,25.00 ,25.00 ,25.00,,,,,,,,14.00,11.00,,,,,,,,,,,,,,,,CPS,C0000E,,,
SO03-IDM220100417,1,Y,12/02/2022,DEDE JUNAEDI,CU02632,PT KIRANA KURNIA KREASI,DPKKI00016,GRAND WISATA - CLUSTER WATER TERRACE BLOK BE18 BE20 BE21 BE25,BEKASI    , ,22FI12A06XXX,300.00 ,244.00 ,14.00,,,,,,,,7.00,7.00,,,,,,,,,,,,,,,,MANUAL,C3000D,,,
SO02-IDM220200122,1,Y,12/02/2022,DEDE JUNAEDI,CT04943,BP INDRA SUBAGIO (NIK 3174101707780004),DRINS00005,PT NOVA CHEMICAL JL SUCI CIJANTUNG SAMPING POOL MAYASARI,JAKARTA TIMUR    , ,25FI12A06XXX,5.00 ,5.00 ,5.00,,,,,,,,5.00,,,,,,,,,,,,,,,,,MANUAL,C0000E,,,
SO02-IDM220200137,1,Y,12/02/2022,FERDY WIDASMARA,CT02667,BP ABDULLAH MUKMIN (NIK 3201071009890006),DRABM00018,JALAN PABRIK FRISIAN FLAG INDONESIA. JL RAYA BOGOR KM 5,JAKARTA    , ,30FI12A06XXX,5.00 ,5.00 ,5.00,,,,,,,,5.00,,,,,,,,,,,,,,,,,MANUAL,,,,
