S/O No.,S/O Line,Main Batch Plant,Schedule Date,Sales Name,Customer ID,Customer Name,Project ID,Project Location,Project Adress,Project Tel,Product Code,Order Qty.,Delivered / Order Volume (M3),1-24Hr,1,2,3,4,5,6,7,8,9,10,11,12,13,14,15,16,17,18,19,20,21,22,23,24,UnLoading Method,Term,Remark,Reason,
,,,,,,,,,,,,,,,,,,,,,,,,,,,,,,,,,,,,,,,,Of,,,
,,,,,,,,,,,,,,,,,,,,,,,,,,,,,,,,,,,,,,,,Payment,,,
PLANT: R01JAT - Jati Asih,,,,,,,,,,,,,,,,,,,,,,,,,,,,,,,,,,,,,,,,,,,
SO03-IDM230100158,1,Y,21/01/2023,HERI KUSWANTO,CU02958,PT ALVINDO BANGUN SARANA MANDIRI,DPABS00188,CLUSTER ZLIVING PERUMAHAN GRAND WISATA TAMBUN,BEKASI    , ,22FI12A06XXX,200.00 ,200.00 ,170.00,,,,,,,,21.00,21.00,21.00,21.00,21.00,21.00,21.00,14.00,9.00,,,,,,,,,CPS,C3000D,,,
SO03-IDM230100083,1,Y,21/01/2023,HERI KUSWANTO,CU02666,PT JAYA TEKNIK PONDASI,DPJTP00003,WORKSHOP JAYA TEKNIK PONDASI. JL CARINGIN NO 149 KAMPUNG RAWA ROKO,BOJONG RAWA LUMBU BEKASI    , ,50PX12A06PTP,70.00 ,15.00 ,14.00,,,,,,,,,,,,,,7.00,7.00,,,,,,,,,,MANUAL,C4500D,,,
SO02-IDM230100340,1,Y,21/01/2023,HERI KUSWANTO,CT05487,BP RAHMATULLAH (NIK 3275020505780029),DRRMT00011,RUMAH SAKIT SELASIH MEDIKA BINTARA,BEKASI    , ,30FV12A06XXX,87.00 ,87.00 ,87.00,,,,,,,,14.00,14.00,14.00,14.00,14.00,14.00,3.00,,,,,,,,,,,CPS,C0000E,,,
SO03-IDM230100173,1,Y,21/01/2023,DEDE JUNAEDI,CU04745,CV. CIBALAGUNG INDAH PERSADA,DPCIP00009,PT PERDANA SETIA ABADI JAYA JL DKI PANGKALAN 5 BANTAR GEBANG,BEKASI    , ,30FV12A06XXX,10.00 ,6.50 ,5.00,,,,,,,,,,,,,,,5.00,,,,,,,,,,MANUAL,C3000A,,,
SO03-IDM230100138,1,Y,21/01/2023,HERI KUSWANTO,CU03010,PT MAJU ANEKA SARANA,DPMAS00028,PT PULAUINTAN/AMBOJA. JL RAYA MABES HANKAM KEL BAMBU APUS,JAKARTA    , ,30FV12A06XXX,250.00 ,250.00 ,50.00,,,,,,,,,,,,,,,,,21.00,21.00,8.00,,,,,,MANUAL,C3000D,,,
