S/O No.,S/O Line,Main Batch Plant,Schedule Date,Sales Name,Customer ID,Customer Name,Project ID,Project Location,Project Adress,Project Tel,Product Code,Delivered / Order Volume (M3),1-24Hr,1,2,3,4,5,6,7,8,9,10,11,12,13,14,15,16,17,18,19,20,21,22,23,24,UnLoading Method,Term,Remark,Reason
,,,,,,,,,,,,,,,,,,,,,,,,,,,,,,,,,,,,,,,Of,,
,,,,,,,,,,,,,,,,,,,,,,,,,,,,,,,,,,,,,,,Payment,,
,,,,,,,,,,,,,,,,,,,,,,,,,,,,,,,,,,,,,,,,,
SO03-IDM210800464,1,Y,10/09/2021,DEDE JUNAEDI,CU04497,CV. SURYA PRATAMA INDONESIA,DPSPT00012,CBD CIBUBUR,CIBUBUR    , ,22PX12A06XXX,0.50 ,0.50 ,,,,,,,,0.50 ,,,,,,,,,,,,,,,,,,C3000D,,
SO03-IDM210900006,1,Y,10/09/2021,ANDRY CHRISTIANTO,CU00135,PT ADHI KARYA ( PERSERO )  TBK,DPAKP00027,PEMBANGUNAN JALUR GANDA KA KM 6+800 S.D 8+500 ANTARA BATUTULIS - CIOMAS,LINTAS BOGOR - SUKABUMI JL KP ERETAN (DI JL UTAMA JL RAYA CIPAKU) KEC BOGOR SELATAN KOTA BOGOR    , ,30PX10A06RBC,500.00 ,6.00,,,,,,,,,,,,,6.00,,,,,,,,,,,,,C4500D,,
SO03-IDM210900007,1,Y,10/09/2021,ANDRY CHRISTIANTO,CU00135,PT ADHI KARYA ( PERSERO )  TBK,DPAKP00027,PEMBANGUNAN JALUR GANDA KA KM 6+800 S.D 8+500 ANTARA BATUTULIS - CIOMAS,LINTAS BOGOR - SUKABUMI JL KP ERETAN (DI JL UTAMA JL RAYA CIPAKU) KEC BOGOR SELATAN KOTA BOGOR    , ,35BX18A06RBC,225.00 ,6.00,,,,,,,,,,,,,,6.00,,,,,,,,,,,,C4500D,,
SO03-IDM210900144,1,Y,10/09/2021,DEDE JUNAEDI,CU04497,CV. SURYA PRATAMA INDONESIA,DPSPT00012,CBD CIBUBUR,CIBUBUR    , ,22PX12A06XXX,2.50 ,2.50 ,,,,,,,,2.50 ,,,,,,,,,,,,,,,,,,C3000D,,
SO02-IDM210900134,1,Y,10/09/2021,ANDRY CHRISTIANTO,CU04781,PT. HUTOMO MANDALA PERKASA,DPHMP00013,PEKERJAAN PEDESTRIAN PENINGKATAN JALAN TEGAR BERIMAN,PEMDA KAB BOGOR    , ,15MI10A06BGR,151.00 ,6.00,,,,,,,,,,6.00,,,,,,,,,,,,,,,,C0000E,,
