S/O No.,S/O Line,Main Batch Plant,Schedule Date,Sales Name,Customer ID,Customer Name,Project ID,Project Location,Project Adress,Project Tel,Product Code,Order Qty.,Delivered / Order Volume (M3),1-24Hr,1,2,3,4,5,6,7,8,9,10,11,12,13,14,15,16,17,18,19,20,21,22,23,24,UnLoading Method,Term,Remark,Reason
,,,,,,,,,,,,,,,,,,,,,,,,,,,,,,,,,,,,,,,,Of,,
,,,,,,,,,,,,,,,,,,,,,,,,,,,,,,,,,,,,,,,,Payment,,
,,,,,,,,,,,,,,,,,,,,,,,,,,,,,,,,,,,,,,,,,,
SO02-IDM220100404,1,Y,29/01/2022,ANDRY CHRISTIANTO,CT05058,BP ALEXA FAHMI (NIK 3201282801810001),DRALF00016,COR JALAN DESA NEGLASARI BOGOR,BOGOR    , ,25FU12A06R1X,40.00 ,1.00 ,1.00,,,,,,,,,,,,,,,,,,,,,,1.00,,,,C0000E,,
SO02-IDM220100406,1,Y,29/01/2022,ANDRY CHRISTIANTO,CT05058,BP ALEXA FAHMI (NIK 3201282801810001),DRALF00014,COR JALAN DESA PURWASARI. KP CIHIDEUNG RT 01 RW 02 DESA PURWASARI DRAMAGA,BOGOR    , ,25FU12A06R1X,40.00 ,1.00 ,1.00,,,,,,,,,,,,,,,,,,,,,,1.00,,,,C0000E,,
SO03-IDM220100379,1,Y,30/01/2022,ANDRY CHRISTIANTO,CU04681,PT. TANGGUH DUTA MERLIN,DPTDL00003,NTI SHELL YASMIN-1. JL KH ABDULLAH BIN NUH NO 8 TAMAN YASMIN,BOGOR    , ,20MI12A0675X,46.00 ,46.00 ,7.00,,,,,,,,,6.00,4.00,,,,,,,,,,,,,,,,C3000A,,
SO02-IDM220100495,1,Y,29/01/2022,LUDI PURNAMA,CU05020,PT. MITRA MAJU ABADI SEJAHTERA,DPMUS00031,KAWASAN INDUSTRI WAHYU SEJAHTERA JL RAYA NAROGONG KM 28 KEMBANG KUNING,KEC KLAPANUNGGAL    , ,LCFU12A06XXX,24.00 ,24.00 ,12.00,,,,,,,,,,,,,,,,,,,,,,,12.00,,,C0000E,,
SO02-IDM220100485,1,Y,30/01/2022,LUDI PURNAMA,CT05227,BP FURKON RAMDANI (NIK 3201051808780002),DRFRA00005,PT PATRIA WIRA KARYA JL SIROJUL MUNIR NANGGEWER CIBINONG,BOGOR    , ,40PX12C06XXX,60.00 ,60.00 ,60.00,,,,,,,,,,,,,,,12.00,12.00,12.00,12.00,12.00,,,,,,,C0000E,,
SO02-IDM220100496,1,Y,29/01/2022,ANDRY CHRISTIANTO,CT05058,BP ALEXA FAHMI (NIK 3201282801810001),DRALF00014,COR JALAN DESA PURWASARI. KP CIHIDEUNG RT 01 RW 02 DESA PURWASARI DRAMAGA,BOGOR    , ,25FU12A06R1X,30.00 ,30.00 ,6.00,,,,,,,,,,,,,,,,,,,6.00,,,,,,,C0000E,,
