S/O No.,S/O Line,Main Batch Plant,Schedule Date,Sales Name,Customer ID,Customer Name,Project ID,Project Location,Project Adress,Project Tel,Product Code,Order Qty.,Delivered / Order Volume (M3),1-24Hr,1,2,3,4,5,6,7,8,9,10,11,12,13,14,15,16,17,18,19,20,21,22,23,24,UnLoading Method,Term,Remark,Reason
,,,,,,,,,,,,,,,,,,,,,,,,,,,,,,,,,,,,,,,,Of,,
,,,,,,,,,,,,,,,,,,,,,,,,,,,,,,,,,,,,,,,,Payment,,
PLANT: R41CTP - Plant Citeureup Bogor,,,,,,,,,,,,,,,,,,,,,,,,,,,,,,,,,,,,,,,,,,
SO02-IDM220400126,1,Y,08/04/2022,LUDI PURNAMA,CU02816,CV INDOBARU MANDIRI,DPIBM00168,HABIB ALWI. COR DAK MASJID JAMI AL BARKAH JL RAYA SUKMAJAYA TAJURHALANG,BOGOR    , ,25PX12A06XXX,18.00 ,18.00 ,18.00,,,,,,,,6.00,6.00,6.00,,,,,,,,,,,,,,,MANUAL,C0000E,,
SO03-IDM220400010,1,Y,08/04/2022,LUDI PURNAMA,CU04427,PT. KARYA ESKA SEJAHTERA,DPKES00006,PROYEK RUMAH TINGGAL DI CLUSTER MARGATA CIMANGGIS GOLF ESTATE,DEPOK    , ,25FI12A06XXX,200.00 ,125.00 ,77.00,,,,,,,,12.00,18.00,24.00,12.00,11.00,,,,,,,,,,,,,CPS,C3000D,,
SO02-IDM220400128,1,Y,08/04/2022,LUDI PURNAMA,CU04927,PT. MIRTADA SEJAHTERA,DPMTS00002,HOTEL SAYAGA WISATA BOGOR JL TEGAR BERIMAN KEL TENGAH,KEC CIBINONG    , ,35PX12A06GAP,57.00 ,57.00 ,6.00,,,,,,,,6.00,,,,,,,,,,,,,,,,,CPS,C0000E,,
SO02-IDM220400133,1,Y,08/04/2022,LUDI PURNAMA,CU05059,CV. ABDI MAHYRA KARYA,DPAMK00013,JL CITAMIANG - TUGU UTARA CISARUA,BOGOR    , ,25FN12A06XXX,100.00 ,100.00 ,100.00,,,,,,,,,,,,,,,,,10.00,12.00,12.00,12.00,12.00,12.00,12.00,18.00,MANUAL,C0000E,,
SO03-IDM220400158,1,Y,08/04/2022,LUDI PURNAMA,CU04616,PT. STRADA CAHYA GEMILANG,DPSCG00061,PT TRIBANGUN PILAR PERSADA. PT GIVAUDAN INDONESIA JL RAYA JAKARTA BOGOR KM 35,CIMANGGIS DEPOK JAWA BARAT    , ,35FI12A06XXX,50.00 ,23.00 ,3.00,,,,,,,,,,,3.00,,,,,,,,,,,,,,MANUAL,C3000D,,
