S/O No.,S/O Line,Main Batch Plant,Schedule Date,Sales Name,Customer ID,Customer Name,Project ID,Project Location,Project Adress,Project Tel,Product Code,Order Qty.,Delivered / Order Volume (M3),1-24Hr,1,2,3,4,5,6,7,8,9,10,11,12,13,14,15,16,17,18,19,20,21,22,23,24,UnLoading Method,Term,Remark,Reason
,,,,,,,,,,,,,,,,,,,,,,,,,,,,,,,,,,,,,,,,Of,,
,,,,,,,,,,,,,,,,,,,,,,,,,,,,,,,,,,,,,,,,Payment,,
PLANT: R32TGD - Plant Tegal Danas - Cikarang,,,,,,,,,,,,,,,,,,,,,,,,,,,,,,,,,,,,,,,,,,
SO02-IDM221100663,1,Y,28/11/2022,DEDE JUNAEDI,CT05782,BP GARCA ATMAJA (NIK 3202131208590001),DRGRA00003,DESA TAJUR JL PARUNG PONTENG,BOGOR    , ,22FN12A06XXX,10.00 ,10.00 ,6.00,,,,,,,,,,,,,6.00, ,,,,,,,,,,,MANUAL,C0000E,,
SO02-IDM221100567,1,Y,28/11/2022,DEDE JUNAEDI,CU04894,PT. TIANIS SURYA ABADI,DPTSA00080,TPK DESA CITEKO KEC CISARUA JL DESA CITEKO,KEC CISARUA    , ,25FN12A06XXX,184.00 ,134.00 ,30.00,,,,,,,,,,,,,,,,,,,12.00,12.00,6.00,,,,MANUAL,C0000E,,
SO02-IDM221100665,1,Y,28/11/2022,DEDE JUNAEDI,CU05380,CV. NANDA PRATAMA KARYA,DPNPK00004,PENINGKATAN JALAN CIMANDE-LEMAH DUHUR KEC. CARINGIN,BOGOR    , ,30MX10A06A3D,134.00 ,134.00 ,60.00,,,,,,,,,,,,,,,,12.00,12.00,12.00,12.00,12.00, ,,,,MANUAL,C0000E,,
SO02-IDM221100463,1,Y,28/11/2022,DEDE JUNAEDI,CU05449,DESA RAWAPANJANG KECAMATAN BOJONG GEDE KAB. BOGOR,DPRPB00002,SAMISADE DESA RAWAPANJANG,KAB BOGOR    , ,25PX12A06XXX,144.00 ,6.00 ,6.00,,,,,,,,,,,,,6.00, ,,,,,,,,,,,MANUAL,C0000E,,
SO02-IDM221100199,1,Y,28/11/2022,DEDE JUNAEDI,CU05449,DESA RAWAPANJANG KECAMATAN BOJONG GEDE KAB. BOGOR,DPRPB00002,SAMISADE DESA RAWAPANJANG,KAB BOGOR    , ,25PX12A06XXX,144.00 ,12.00 ,6.00,,,,,,,,,,,,,,6.00,,,,,,,,,,,,C0000E,,
