S/O No.,S/O Line,Main Batch Plant,Schedule Date,Sales Name,Customer ID,Customer Name,Project ID,Project Location,Project Adress,Project Tel,Product Code,Order Qty.,Delivered / Order Volume (M3),1-24Hr,1,2,3,4,5,6,7,8,9,10,11,12,13,14,15,16,17,18,19,20,21,22,23,24,UnLoading Method,Term,Remark,Reason
,,,,,,,,,,,,,,,,,,,,,,,,,,,,,,,,,,,,,,,,Of,,
,,,,,,,,,,,,,,,,,,,,,,,,,,,,,,,,,,,,,,,,Payment,,
PLANT: R41CTP - Plant Citeureup Bogor,,,,,,,,,,,,,,,,,,,,,,,,,,,,,,,,,,,,,,,,,,
SO03-IDM220200047,1,Y,24/03/2022,LUDI PURNAMA,CU04427,PT. KARYA ESKA SEJAHTERA,DPKES00006,PROYEK RUMAH TINGGAL DI CLUSTER MARGATA CIMANGGIS GOLF ESTATE,DEPOK    , ,25FI12A06XXX,200.00 ,59.00 ,70.00,,,,,,,,12.00,18.00,24.00,16.00,,,,,,,,,,,,,,CPS,C3000D,,
SO02-IDM220300243,1,Y,24/03/2022,LUDI PURNAMA,CT01873,BP HERI KUSUMA (NIK 3271040704810022),DRHRK00279,COR RUMAH IBU AYU PERUM BOGOR BARU BLOK D VII NO 8 TEGALEGA,BOGOR TENGAH    , ,22FI12A06XXX,13.00 ,13.00 ,13.00,,,,,,,,13.00,,,,,,,,,,,,,,,,,CPS,C0000E,,
SO02-IDM220200293,1,Y,24/03/2022,LUDI PURNAMA,CU04927,PT. MIRTADA SEJAHTERA,DPMTS00002,HOTEL SAYAGA WISATA BOGOR JL TEGAR BERIMAN KEL TENGAH,KEC CIBINONG    , ,35PX12A06GAP,320.00 ,76.00 ,45.00,,,,,,,,5.00,12.00,6.00,14.00,8.00,,,,,,,,,,,,,MANUAL,C0000E,,
SO03-IDM220300305,1,Y,24/03/2022,LUDI PURNAMA,CU04616,PT. STRADA CAHYA GEMILANG,DPSCG00061,PT TRIBANGUN PILAR PERSADA. PT GIVAUDAN INDONESIA JL RAYA JAKARTA BOGOR KM 35,CIMANGGIS DEPOK JAWA BARAT    , ,35FI12A06XXX,50.00 ,45.50 ,18.00,,,,,,,,,,,,,,6.00,6.00,6.00,,,,,,,,,MANUAL,C3000D,,
SO02-IDM220300281,1,Y,24/03/2022,LUDI PURNAMA,CT01873,BP HERI KUSUMA (NIK 3271040704810022),DRHRK00280,LOCO. RUMAH TNGGAL BP WIWIT PERUM BUMI AGUNG RESIDENCE PASIR PUTIH,DEPOK    , ,22FI12A06XXX,11.00 ,11.00 ,11.00,,,,,,,,,,,,6.00,5.00,,,,,,,,,,,,MANUAL,C0000E,,
