S/O No.,S/O Line,Main Batch Plant,Schedule Date,Sales Name,Customer ID,Customer Name,Project ID,Project Location,Project Adress,Project Tel,Product Code,Order Qty.,Delivered / Order Volume (M3),1-24Hr,1,2,3,4,5,6,7,8,9,10,11,12,13,14,15,16,17,18,19,20,21,22,23,24,UnLoading Method,Term,Remark,Reason
,,,,,,,,,,,,,,,,,,,,,,,,,,,,,,,,,,,,,,,,Of,,
,,,,,,,,,,,,,,,,,,,,,,,,,,,,,,,,,,,,,,,,Payment,,
,,,,,,,,,,,,,,,,,,,,,,,,,,,,,,,,,,,,,,,,,,
SO03-IDM230100089,1,Y,13/01/2023,LUDI PURNAMA,CU00355,PT VICTORIA KARYA,DPVKA00019,RUKO CIMANGGIS GOLF ESTATE JL EMERALDA GOLF BOULEVARD KEC TAPOS DEPOK,JAWA BARAT (EXIT TOL CIMANGGIS 3)    , ,30FD12A06XXX,10.00 ,10.00 ,10.00,,,,,,,,6.00,4.00,,,,,,,,,,,,,,,,MANUAL,C3000D,,
SO02-IDM230100175,1,Y,13/01/2023,DEDE JUNAEDI,CU05398,PT. EDGAR JAYA ABADI,DPEJA00008,"PT. CITRA BAJATAMA RAYA - INDO BOGA UTAMA, JL. BOJONG NANGKA RT 20/09",GUNUNG PUTERI    , ,35PX12A06XXX,42.00 ,42.00 ,40.00,,,,,,,,12.00,18.00,10.00,,,,,,,,,,,,,,,MANUAL,C0000E,,
SO02-IDM230100180,1,Y,13/01/2023,ANDRY CHRISTIANTO,CU05546,PT. JELAJAH AMERTA MAHAKARYA,DPJAM00002,DESA CEMPLANG CIBUNGBULANG,BOGOR    , ,25FN12A06R1X,100.00 ,100.00 ,30.00,,,,,,,,,,,,,6.00,6.00,6.00,6.00,6.00,,,,,,,,MANUAL,C0000E,,
SO02-IDM230100184,1,Y,13/01/2023,LUDI PURNAMA,CU05361,PT. PRIANGAN BANGUN NUSANTARA,DPPBN00066,PEMBANGUNAN JEMBATAN SITU NANGGERENG (JALUR LAMBAT ARAH KEMANG) PADA JALAN,BOJONG GEDE - KEMANG KECAMATAN TAJUR HALANG KAB BOGOR    , ,20MX12A06XXX,95.00 ,95.00 ,65.00,,,,,,,,,,,,,12.00,12.00,12.00,12.00,12.00,5.00,,,,,,,MANUAL,C0000E,,
SO02-IDM230100096,1,Y,13/01/2023,DEDE JUNAEDI,CU05515,PT. LAUTAN BERKAH KONSTRUKSI,DPLBO00002,JALAN RAYA BOGOR KM 49 CIJUJUNG KEC SUKARAJA,BOGOR JAWA BARAT 16710    , ,40FI12A06XXX,40.00 ,34.50 ,4.50,,,,,,,,,,4.50,,,,,,,,,,,,,,,MANUAL,C0000E,,
